{
  "feature_slug": "shark-engine-air-release-1",
  "language": "de",
  "mode": "PLUMBLINE_READY_PACKAGE",
  "readiness_level": "READY_FOR_USER_CONFIRMATION",
  "source_map": [
    {
      "source_id": "SRC-001",
      "source_kind": "user_provided",
      "summary": "Vom Nutzer sequenziell bestätigte Produktanforderungen: AIR Release 1 abschließen; AIR/LAND/WATER-Auswahl beibehalten; generischer Pilotensitz; Copilotensitz; Wiedereinstieg; Weiterbau; Fuel/Flugsteuerung; farbige Kondensstreifen; Looping nachgelagert; Zieltermin 30.07.2026."
    },
    {
      "source_id": "SRC-002",
      "source_kind": "user_provided",
      "summary": "Finalisiertes AI-Native PRD für Shark Engine AIR Release 1 mit Architektur, Akzeptanzkriterien, Tests, Risiken und Agent-Handoff."
    },
    {
      "source_id": "SRC-003",
      "source_kind": "repository_evidence",
      "summary": "Anforderungsevaluation zur Vehicle-Plattform, Cockpit und Looping; statisch aus dem Repository und den Nutzeranforderungen abgeleitet."
    },
    {
      "source_id": "SRC-004",
      "source_kind": "repository_evidence",
      "summary": "Codebase-Audit der Shark Engine mit statischen Findings; vollständiger Gradle-/Runtime-Nachweis blieb offen."
    },
    {
      "source_id": "SRC-005",
      "source_kind": "repository_evidence",
      "summary": "Gepatchter Shark-Engine-Repository-Snapshot; als Quellbasis vorhanden, aber nicht als vollständig runtime-verifiziert zu behandeln."
    },
    {
      "source_id": "SRC-006",
      "source_kind": "standard_or_framework",
      "summary": "Minecraft-Java-Modding-Leitfaden: Java 21, Gradle/Fabric, serverseitige Autorität, gestufte Test- und Profiling-Workflows."
    },
    {
      "source_id": "SRC-007",
      "source_kind": "standard_or_framework",
      "summary": "Plumbline AgileTeam Intake Contracts für getrennte Vision-, Canvas-, PRD- und Traceability-Artefakte sowie explizite Nutzerbestätigung."
    }
  ],
  "artifacts": {
    "prd": {
      "title": "Shark Engine AIR Release 1 — Plumbline AgileTeam PRD",
      "status": "ready-for-user-confirmation",
      "feature_slug": "shark-engine-air-release-1",
      "owner": {
        "value": "Ben als Anforderungsgeber; formale Product-Owner-Rolle für das Repository ist nicht separat bestätigt.",
        "source_type": "ASSUMPTION",
        "source_refs": [
          "SRC-001"
        ]
      },
      "source_summary": "Konsolidiert aus der sequenziellen Nutzerklärung, dem finalisierten AI-Native PRD, der Anforderungsevaluation und dem statischen Repository-Audit. Runtime-Verhalten bleibt bis zu Build-/GameTest-/Client-/Server-Nachweisen UNVERIFIED.",
      "problem_statement": {
        "id": "CAN-001",
        "value": "Der AIR-Prototyp deckt wesentliche Teile des Flugzeug-Gameplays ab, ist aber noch nicht als durchgängiger, runtime-verifizierter Release abgeschlossen. Sitzlogik, Copilot, Wiedereinstieg, sicherer Weiterbau, persistente Trail-Farben und eine begrenzte Vehicle-Core-Trennung fehlen oder sind nicht vollständig nachgewiesen.",
        "source_type": "EXPLICIT",
        "source_refs": [
          "SRC-002",
          "SRC-003",
          "SRC-004"
        ]
      },
      "target_users": [
        {
          "id": "CAN-002",
          "value": "Primär: Minecraft-Spieler, die eigene blockbasierte Fluggeräte bauen und steuern.",
          "source_type": "EXPLICIT",
          "source_refs": [
            "SRC-001"
          ]
        },
        {
          "id": "CAN-003",
          "value": "Sekundär: Mitspieler, die als passive Copiloten mitfliegen.",
          "source_type": "EXPLICIT",
          "source_refs": [
            "SRC-001"
          ]
        }
      ],
      "goals": [
        {
          "id": "GOAL-001",
          "value": "AIR-Fahrzeug bis 30.07.2026 als vollständigen, runtime-verifizierten Release abschließen.",
          "source_type": "EXPLICIT",
          "source_refs": [
            "SRC-001"
          ]
        },
        {
          "id": "GOAL-002",
          "value": "Crafting, Bau, Assembly, Cockpit, Flug, Fuel, Aus-/Wiedereinstieg, Weiterbau, Multiplayer und Persistenz zu einem kohärenten End-to-End-Flow verbinden.",
          "source_type": "EXPLICIT",
          "source_refs": [
            "SRC-001",
            "SRC-002"
          ]
        },
        {
          "id": "GOAL-003",
          "value": "Nur die minimale gemeinsame Vehicle-Core-Architektur schaffen, die spätere LAND/WATER-Routen ohne Kern-Duplikation ermöglicht.",
          "source_type": "EXPLICIT",
          "source_refs": [
            "SRC-001",
            "SRC-002"
          ]
        }
      ],
      "non_goals": [
        {
          "id": "CAN-012",
          "value": "Keine ausführbaren LAND- oder WATER-Fahrzeuge in Release 1.",
          "source_type": "EXPLICIT",
          "source_refs": [
            "SRC-001"
          ]
        },
        {
          "id": "CAN-013",
          "value": "Kein Looping als Release-1-MVP-Anforderung.",
          "source_type": "EXPLICIT",
          "source_refs": [
            "SRC-001"
          ]
        },
        {
          "id": "CAN-014",
          "value": "Keine physikalisch vollständige Aerodynamiksimulation.",
          "source_type": "EXPLICIT",
          "source_refs": [
            "SRC-002"
          ]
        }
      ],
      "assumptions": [
        {
          "id": "ASM-001",
          "value": "Bis zur Nutzerpräzisierung wird die Fünf-Block-Regel als maximale räumliche Distanz vom Spieler zum Control Anchor im stationären sicheren Zustand behandelt.",
          "source_type": "ASSUMPTION",
          "source_refs": [
            "SRC-001",
            "SRC-002"
          ]
        },
        {
          "id": "ASM-002",
          "value": "Der Pilotensitz wird anhand des Steering-Wheel-Facings auf eine deterministische angrenzende Position 'vor' dem Steuerrad abgebildet.",
          "source_type": "ASSUMPTION",
          "source_refs": [
            "SRC-001",
            "SRC-002"
          ]
        },
        {
          "id": "ASM-003",
          "value": "Release 1 unterstützt die 16 normalen Minecraft-Farbstoffe; der genaue Crafting-/Recolor-Flow ist vor Implementierung zu bestätigen.",
          "source_type": "ASSUMPTION",
          "source_refs": [
            "SRC-001",
            "SRC-002"
          ]
        },
        {
          "id": "ASM-004",
          "value": "Ein Copilotensitz trägt genau einen Spieler; Release 1 garantiert mindestens einen zusätzlichen Passagier.",
          "source_type": "ASSUMPTION",
          "source_refs": [
            "SRC-001",
            "SRC-002"
          ]
        },
        {
          "id": "ASM-005",
          "value": "Vehicle Core wird nur bis zu den für AIR unmittelbar benötigten Seams extrahiert; keine vorsorgliche LAND/WATER-Physikabstraktion.",
          "source_type": "ASSUMPTION",
          "source_refs": [
            "SRC-002",
            "SRC-003"
          ]
        }
      ],
      "open_questions": [
        {
          "id": "OQ-001",
          "value": "Bedeutet die Fünf-Block-Regel euklidische Distanz zum Control Anchor, horizontale Distanz oder ausschließlich maximale vertikale Höhe?",
          "source_type": "ASSUMPTION",
          "source_refs": [
            "SRC-001",
            "SRC-002"
          ]
        },
        {
          "id": "OQ-002",
          "value": "Soll die Trail-Farbe durch Crafting eines neuen Thrusters, durch nachträgliches Färben eines platzierten Thrusters oder durch beide Wege geändert werden?",
          "source_type": "MISSING",
          "source_refs": [
            "SRC-001"
          ]
        },
        {
          "id": "OQ-003",
          "value": "Welche sichtbare Körpergrenze gilt für 'nur der Kopf schaut heraus' bei Rüstung, unterschiedlichen Skins und Third-Person-Kamera?",
          "source_type": "MISSING",
          "source_refs": [
            "SRC-001",
            "SRC-002"
          ]
        },
        {
          "id": "OQ-004",
          "value": "Wie wird 'Sitz vor dem Steering Wheel' exakt aus dessen Facing abgeleitet, wenn mehrere gültige angrenzende Positionen existieren?",
          "source_type": "ASSUMPTION",
          "source_refs": [
            "SRC-001",
            "SRC-002"
          ]
        },
        {
          "id": "OQ-005",
          "value": "Welches reproduzierbare Hardware-/Szenario-Baseline gilt für die Performance-Abnahme farbiger Partikel und maximaler AIR-Blueprints?",
          "source_type": "MISSING",
          "source_refs": [
            "SRC-002"
          ]
        }
      ],
      "requirements": [
        {
          "id": "REQ-001",
          "title": "Vehicle route popup",
          "priority": "P0",
          "statement": "Beim Platzieren oder Interagieren mit dem Steering Wheel muss das bestehende Popup die Routen AIR, LAND und WATER anzeigen.",
          "source_type": "EXPLICIT",
          "source_refs": [
            "SRC-001",
            "SRC-002"
          ],
          "vision_ids": [
            "VIS-001",
            "VIS-004"
          ],
          "canvas_ids": [
            "CAN-006",
            "CAN-024"
          ],
          "risk_ids": [
            "RISK-001"
          ],
          "acceptance_criteria_ids": [
            "AC-001"
          ],
          "evidence_ids": [
            "EV-001"
          ]
        },
        {
          "id": "REQ-002",
          "title": "Release route availability",
          "priority": "P0",
          "statement": "Release 1 darf nur AIR als ausführbare Route aktivieren; LAND und WATER bleiben sichtbar, aber nicht fahrzeugerzeugend und werden als zukünftige Routen gekennzeichnet.",
          "source_type": "EXPLICIT",
          "source_refs": [
            "SRC-001",
            "SRC-002"
          ],
          "vision_ids": [
            "VIS-009"
          ],
          "canvas_ids": [
            "CAN-006",
            "CAN-012"
          ],